,,asin,summary,ae_words_list,input_words_list
,75,B00004SGD3,sony bravia dsc hdr hdr hdr hdr hdr hdr hdr hdr hdr hdr hdr hdr hdr hdr hdr hdr hdr hdr hdr hdr hdr hdr hdr hdr hdr hdr hdr hdr hdr hdr hdr hdr hdr hdr hdr hdr hdr hdr hdr hdr hdr hdr hdr hdr hdr hdr hdr hdr hdr hdr hdr hdr hdr hdr hdr hdr hdr hdr hdr hdr hdr hdr hdr hdr hdr hdr hdr hdr hdr hdr hdr hdr hdr hdr hdr hdr hdr hdr hdr hdr hdr hdr hdr hdr hdr hdr hdr hdr hdr hdr hdr hdr hdr hdr hdr hdr hdr,"[""over my post of found to the of a very a titan 80's and be server version and drive <OOV> is a far the best price ever and it have able by msi scheme is a protection adequate bit keyboard perfect finish with the and it look with a about good to install the set with only price of i've the only the interface to a iphone and and with not with the software downloading nearly detail images video detail the time and the previous i 2 minutes the not not i looking to go a new <OOV> to get"", ""well my jbl's in a a a very little good one but it wife <OOV> it is it got it for school for and was and and lot early it shipping the it bought expecting excited to it product product but it not worth to use a on and the diego it reviews the see store and used to the different <OOV> to far bought it could say it insight me view that comparison but only time i can is that the you it it pictures is and is it of them best film and and and and rips and"", 'i upgraded from a a better <OOV> and the screen and and bought not sure about the exact but would a exact saver go and it was a a low to it it dad for would it fact of quality price of the screen and bit little and to the other screen screen screen and the screen fitness it would it whole of purchase price of it there last are and i is no better words better and that the price fitness school same and it place good color good shipping do it price it screen area is been better', ""i'm a bought time ago pilot of had it of iphones of the car but but but but bought it charger product but but not is seem to it a it could it do with it get found to get it new one <OOV> it amazon different and tj and it loved it and worth to use and the does what that that the the previous it case it the uncomfortable it the price and protector leather and leather is not but only is is not but only thing is is is it say to that in the access for"", 'sony did did very very job the the exterior <OOV> hdr one was was me was lot was this one was the not is one was not solid and the the one 3 that a well and well well well well in the pocket and only is was the the and not the fast and with with not good and stated as instructions protector very and the when the i facebook tablet tablet i not great to am not had a problem issue and the case and weeks and am to it case was a a good and watching wife', 'if you have not overhead to do the a right model device but only worked <OOV> model does not a a you description stated but tried it dock xp 3 that it last hp wizards and a a bit up with does does to price me with laptop of the fitness of only web not is are is good and the interface does does does not that that things have have to use a extra on on the different one card with card with have this micro card card to my delivery files data devices files to not buy on', 'so not got not little swimming and it is really will it better 34 junk that 34 gorilla say it it you just it product <OOV> need do it phone it of and not then and what and and a own and is a best inexpensive thing it there it and and even it lot to it one one one one same and and is lot or it it it it it it password and and it it it and can want to know buy it one it it the other pro reviews notes but is does a for son', 'the hp with user is a user of one really a really and is not and the the a same of the screen that have a of a for a use after the product was a quality a exception of the up the computer the plug the exception of the device device device is my device it device nor all but i there i do it of product of product is is it operation is the review to is it and little things protectors and <OOV> <OOV> <OOV> i you to use with the that have have have to that']","[""over the years i've used all kinds of pdas from the early <OOV> to the latest <OOV> the jornada <OOV> is by far the best i've used and don't be fooled the color screen provides more than eye candy the beautiful implementation of color makes screens filled with information very easy to use to me the greatest asset though is the <OOV> simple interface with my desktop pc synching is effortless and the process shares much more detailed contact and appointment data than my <OOV> series 5 ever did also when you're ready to buy a jornada try to spend"", ""well the folks at ups made me a very happy guy when my <OOV> <OOV> this morning i bought it at amazon com it arrived <OOV> a day and a half later i was so excited about this new model but was totally unable to find them here in san diego amazon com to the rescue i've upgraded from a jornada 420 so i feel i can provide an informed side by side comparison the first thing you notice is just how <OOV> cool the <OOV> looks it carries none of the quot purple plastic brick quot visual baggage of"", 'i upgraded from using a palm <OOV> to the <OOV> <OOV> i was not sure about the move but had the money to <OOV> if there is such a thing and bought my <OOV> i love the heft and the look of the screen a marvelous machine compared to the grainy grey green screen of the palm but i miss the simplicity to the palm what are these things for anyway there are many more really clever applications for the palm at the moment like a very accurate and fast tide and current <OOV> the pocket pc has a much', ""i'm a long time palm user i've bought three different versions over the last three years overall i think the palm's are ok but there always seemed to be something i wanted to do but couldn't i managed to get a new jornada <OOV> from a friend at hp and absolutely love it it's simple to use and it does so much more than my palm the browser is very good given the constrained screen real estate the color is great the media player is great the only thing it lacks that i'd like is built in wireless support if"", ""hp really did a great job on the jornada <OOV> the thing that impressed me a lot about this unit was its construction the unit is very sturdy as is the usb cradle it's very sleek and stylish fits very comfortably in your hand the response time to opening programs is also very quick handwriting recognition was pretty accurate as well the screen is bright and clear reading ebooks on the microsoft reader is a snap i have not had the os crash in the past few days i have had the unit it's been pretty stable while my windows"", ""if you have been waiting to purchase just the right handheld device the hp jornada pocket pc may be just what the doctor ordered i've owned other windows ce devices but these new pocket pc's are quite a step up it really <OOV> fair to compare these devices to palm devices the palm's do what they do very well however the pocket pc just does so much more you must plan to spend the extra money on a compact flash card cf card i recommend a usb enabled card for fast copying of those great mp3's do not rely on"", ""so you are a budding <OOV> and inspiration hits you got a piece of paper nearby nope too bad but if you buy the jornada you can write your thoughts out instantly or better yet just dictate them into its mike this is the most amazing pda out there palm palm doesn't hold a candle to this palms are just glorified address books why a pocket pc puts palms to shame 1 word excel outlook money and pocket streets you may want to re read this one yes all the semi decent microsoft products which actually are useful my favourite"", 'the hp jornada <OOV> makes the palm pilot look like a dinosaur it is slick and truly is the extension to the desktop we have all been looking for initial impressions of the unit are good with the exception of setting up my modem accessory and the configuration of the active sync software on the desktop neither worked at first overall however once you work out the issues the jornada <OOV> makes its statement in a hurry windows runs nicely a few screen lockups and the included applications allow me to work in places i never would have imagined all']"
,76,B00004SYNX,having bought a computer with no problems at all and would not recommend this product to anyone else looking for a new one for a while and then again would not work at all and would not recommend this to anyone who wants to replace their own their product is not worth the money and effort to return it and buy this product again if you are looking for a new one that is why you need this one you need to do not have a lot of the same thing that is not going to be a good deal,"['i bought my son link is is all price is just not recommend this to any internet price and great some charm just am just of and just are just just described and 7 and a own problem and problem to go it card and i on and am it card to my 7 and it 7 to my same and i great a champ no would recommend it to to anyone who cares to <OOV> <OOV> <OOV> <OOV> <OOV> <OOV> <OOV> <OOV> <OOV> <OOV> <OOV> <OOV> <OOV> <OOV> <OOV> <OOV> <OOV> <OOV> <OOV> <OOV> <OOV> <OOV> <OOV> <OOV> <OOV>', 'installed in charging 7 <OOV> to a with install with and good minutes later install and a and very and was very to install with to to great <OOV> <OOV> <OOV> <OOV> <OOV> <OOV> <OOV> <OOV> <OOV> <OOV> <OOV> <OOV> <OOV> <OOV> <OOV> <OOV> <OOV> <OOV> <OOV> <OOV> <OOV> <OOV> <OOV> <OOV> <OOV> <OOV> <OOV> <OOV> <OOV> <OOV> <OOV> <OOV> <OOV> <OOV> <OOV> <OOV> <OOV> <OOV> <OOV> <OOV> <OOV> <OOV> <OOV> <OOV> <OOV> <OOV> <OOV> <OOV> <OOV> <OOV> <OOV> <OOV> <OOV> <OOV> <OOV> <OOV> <OOV> <OOV> <OOV> <OOV> <OOV> <OOV> <OOV> <OOV> <OOV> <OOV> <OOV> <OOV> <OOV> <OOV> <OOV> <OOV>', 'i bought a really that that that had not had new in one cable it little strike and it it new on it had not to return it new express with get it card it whole one worked got it it exact link card but it bought able to it reviews was does it it card is not but a but it was card is is a but it and are to but times and not same settings it to to the people it is work but a or or it to it i been problem but example minutes or', 'an excellent product very a great good price and am up with of wear and the and course websites of they <OOV> is are been been in and only time <OOV> <OOV> <OOV> <OOV> <OOV> <OOV> <OOV> <OOV> <OOV> <OOV> <OOV> <OOV> <OOV> <OOV> <OOV> <OOV> <OOV> <OOV> <OOV> <OOV> <OOV> <OOV> <OOV> <OOV> <OOV> <OOV> <OOV> <OOV> <OOV> <OOV> <OOV> <OOV> <OOV> <OOV> <OOV> <OOV> <OOV> <OOV> <OOV> <OOV> <OOV> <OOV> <OOV> <OOV> <OOV> <OOV> <OOV> <OOV> <OOV> <OOV> <OOV> <OOV> <OOV> <OOV> <OOV> <OOV> <OOV> <OOV> <OOV> <OOV> <OOV> <OOV> <OOV> <OOV> <OOV> <OOV> <OOV> <OOV> <OOV> <OOV>', 'having remote dubbing key a before the and very and it and <OOV> at had used used with and to with very of a and the is is and manual and not misleading but the but and the and but but was but you to a internet website write and write and the it and the and and course not is no way to and is it and thing <OOV> <OOV> <OOV> <OOV> <OOV> <OOV> <OOV> <OOV> <OOV> <OOV> <OOV> <OOV> <OOV> <OOV> <OOV> <OOV> <OOV> <OOV> <OOV> <OOV> <OOV> <OOV> <OOV> <OOV> <OOV> <OOV> <OOV> <OOV> <OOV> <OOV> <OOV>', ""bought bought bought i don't not problems not it laptop it it it it would not cord and cord was this product great much that i when it would out to it old would not worth same one but bought it would it cord one and and it worked not well <OOV> <OOV> <OOV> <OOV> <OOV> <OOV> <OOV> <OOV> <OOV> <OOV> <OOV> <OOV> <OOV> <OOV> <OOV> <OOV> <OOV> <OOV> <OOV> <OOV> <OOV> <OOV> <OOV> <OOV> <OOV> <OOV> <OOV> <OOV> <OOV> <OOV> <OOV> <OOV> <OOV> <OOV> <OOV> <OOV> <OOV> <OOV> <OOV> <OOV> <OOV> <OOV> <OOV> <OOV> <OOV> <OOV> <OOV> <OOV> <OOV>"", ""after turned yr old 2011 so cord in speaker cord with out and a sony so with complaints but bought it go go with it price price it up it little e cable with using whole it it stared and it and a little screen and it phone it would it it know it get know what it would going with it people and not saying on last and it works up and are fit fit it in and and if don't it one and and is me a to price bought it in and it worked immediately well to"", 'the keyboard on of my asus 2008 core s a worth with this 8 so 2008 and would to to to my me to have my card card a 7 and and and would great and is very and a and it and with and i am to a 7 2008 and i card is great i a i of the card and is has to install and works work to be to a card card <OOV> <OOV> <OOV> <OOV> <OOV> <OOV> <OOV> <OOV> <OOV> <OOV> <OOV> <OOV> <OOV> <OOV> <OOV> <OOV> <OOV> <OOV> <OOV> <OOV> <OOV> <OOV> <OOV> <OOV>']","['i purchased my d link nic at best buy but would highly recommend this to the amazon buyer works like a champ i purchased two more and they worked great as well windows xp had its own drivers no need to install the drivers that are included i used the card with win 2000 and win 98se in the past and worked like a champ i would recommend this card to anyone who needs one', 'installed in win 98 machine took seconds to install drivers a few minutes to install into machine restarted machine and was ready to go easy instructions works fine', ""i have a g4 tower mac that did have a built in ethernet unfortunately a lightening strike took out the port and i was forced to get a pci card to replace the port the first card i bought was the d link <OOV> <OOV> i was excited because the box clearly said that the card would work with macs and that the minimum requirement was os 10 2 they lied os 10 2 is the maximum for this card for most people it won't work with 10 3 and up d link has no driver for 10 3 or"", 'an excellent product at a very reasonable price i set up lots of workstations on networks of various kinds and the <OOV> <OOV> has always installed perfectly the first time', ""have had several in operation on xp m e and 98 se computers have been mostly trouble free small problems worked out with assistance of helpfull phone staff user's guide is somewhat confusing on page 17 under title quot software installation quot directs you to the quot read me quot file on root directory of installation <OOV> of course there is no <OOV> file there but well nobody's perfect"", 'bought this because i was having trouble with my internet connection and suspected it was ethernet adapter the price for this was so low that even though it turned out that my problem was not the old adapter i removed i left the new one installed and it is performing well', ""after 9 yrs of use the built in ethernet card burnt out on my desktop pc no biggie i figured i'll just go to best buy and pick up a pci ethernet card after the b buy employee stared at me with a blank look on his face i said let me guess you don't know what i am talking about those guys are just morons these days anyhow it ends up they don't even carry them in store so i ordered this one online it cost like 10 great i plugged it in and it worked pretty easy stuff"", ""the network component on my old intel mb was not supported by windows 2008 server r2 i ordered this card to enable me to use the mb with windows server 2008 r2 it works perfectly card is recognized on install and driver loaded automatically later i upgraded to windows server 2012 and the card works perfectly with that version of the server product also easy to install and didn't have to bother with the install cd""]"
,77,B00004TDL2,i bought a new ipad 2 and it works great great price but the screen protector does not work as the other reviewers have mentioned the screen protector is not aligned to do not have a stylus to do not buy this product again if you have a new ipad 2 of the screen protectors i have tried to do not recommend this to anyone who wants to replace their screen protector not sure if they are going to be a waste of money and not worth the money on the screen protector it is not worth the money and,"['over you remote to a and but bit and just is not but that only <OOV> just really sony sony that that really of 3 bit that drive that that really to that really do it just not all like have not the own but with have found with and the processing and the folders and iphones computer <OOV> a with a regards and not does as i to a and work i i least and get with generated 3 ghz it to that work i to it etc the a and and and the not to be you my', ""i've had my mac for a a year and it it it use know it it the time it dont it it loved it it it to is with a good instructions and and my and it work easier for wish of the box and complaints to buy it pics and to figure it to work it of time that want to to do your that only thing thing are used it it is to a on it that it processing etc youtube than i this good view msi and and a for go able to get and drop and"", ""i love my family sony with loved it to to than one other but have tried used and the ipod you does and was unresponsive sooner than the year and was used it of problems and the ipod fitness are cut for use with with the up the the only on does a best important for for don't found bought and and the excellent of android to can it for the the home and star what very up with my one clock is of and that hold the the with miles to on to music dock music wma <OOV> quality"", 'i have for for dad for a year and and it am found overhead to no with was been my expectations expectation and screen is was the not the screen is the background is mic is the are very good quality the battery of very and sure noice to are using having a adapter to wont going a higher with write on a months of scheme bit s memory with going will fine will a worth i lot notch the line sony i i stars ago and and am recommend back the bag because than say mentioned it lot job', 'this is very excellent product it you are it it a a very 7 3 3 5 that <OOV> it <OOV> <OOV> is a good feel sound and up and it not too it looking it it did would what it would a advantages minor advantages and price screen is is and is it a to to put into it pocket or would had that it couple would a following it as it is for from would it whole out a how camping it have it on my lot and to with it to my to music and it and', 'i bought bought an earlier sony one and a ipod and but had one really one but get with this one one the wish one one case one a little smallish the side side the but by to the similar but not with the with the only quality is be a the the not the other side of wanted like to get understand the down retry up on a practice but but of the back side of the are some times other tools for the and not for you looking going with this case set i are the screen model', 'i have bought and and and this and it is not far the best price one one ever hdr it not buy it it is it it <OOV> <OOV> <OOV> <OOV> <OOV> <OOV> <OOV> <OOV> <OOV> <OOV> <OOV> <OOV> <OOV> <OOV> <OOV> <OOV> <OOV> <OOV> <OOV> <OOV> <OOV> <OOV> <OOV> <OOV> <OOV> <OOV> <OOV> <OOV> <OOV> <OOV> <OOV> <OOV> <OOV> <OOV> <OOV> <OOV> <OOV> <OOV> <OOV> <OOV> <OOV> <OOV> <OOV> <OOV> <OOV> <OOV> <OOV> <OOV> <OOV> <OOV> <OOV> <OOV> <OOV> <OOV> <OOV> <OOV> <OOV> <OOV> <OOV> <OOV> <OOV> <OOV> <OOV> <OOV> <OOV> <OOV> <OOV> <OOV> <OOV> <OOV> <OOV> <OOV> <OOV>', 'the only is was good quality is is is damage plastic yet is my a is screen case is is i not and well made and very a protection to am it and lot <OOV> <OOV> <OOV> <OOV> <OOV> <OOV> <OOV> <OOV> <OOV> <OOV> <OOV> <OOV> <OOV> <OOV> <OOV> <OOV> <OOV> <OOV> <OOV> <OOV> <OOV> <OOV> <OOV> <OOV> <OOV> <OOV> <OOV> <OOV> <OOV> <OOV> <OOV> <OOV> <OOV> <OOV> <OOV> <OOV> <OOV> <OOV> <OOV> <OOV> <OOV> <OOV> <OOV> <OOV> <OOV> <OOV> <OOV> <OOV> <OOV> <OOV> <OOV> <OOV> <OOV> <OOV> <OOV> <OOV> <OOV> <OOV> <OOV> <OOV> <OOV> <OOV> <OOV> <OOV> <OOV> <OOV>']","['to the meat of this review a palm or handspring is fine but the hp is a true pocket pc add a type 1 128 mb flash chip and you have something you can use to do almost anything you do on your desktop computer i have passed excel and word documents between the desktop and the hp and edited in both locations and it works flawlessly connection at home to outlook and at work to <OOV> notes 4 6 using <OOV> software all notes emails address books to do calendar sync flawlessly and are there to remind use and', ""i've had my jornada for about a year now and while i don't use it all the time i at least always have it with me it comes with fairly useful applications already on it making it very useable straight out of the box no need to download several programs just to get it to do all the things you want it to in fact the only other programs i've put on it have been games with things like word excel and outlook functionality in a windows dominated work world it's good to be able to drag and drop and"", 'i love my pocket pc i use this thing more than any device i have ever owned from the moment it arrived it became much more than a gadget i have owned lots of gadgets including the palm they were great to carry around and show off but the pocket pc is the most useful thing i have ever owned here is an example of how i use it through out my day 5 00 am wake up to the alarm it plenty loud enough to <OOV> even me 7 00 am listen to mp3 s or sometimes audio books', ""i have had my jornada for a month now and i have been nothing but pleased it has exceeded my every expectation the color 12 bit is wonderful the sound from the built in speaker and headphones is surprisingly good and the functionality is astounding make no mistake you are not buying an organizer you are buying a computer 133 mhz processer 12 bit color 32 mb of ram is it just me or wasn't that a top of the line desktop computer 5 yrs ago well i won't go into the basics other reviewers have done a good job"", ""this is an excellent product if you like me are replacing a windows ce 2 0 product compaq <OOV> the jornada <OOV> has a nice clear well lit screen but certainly not what was advertised as we all know and it has some very nice features the protective cover amp sleek design make it easy just to slip into your pocket i have found that a unit is only as good as it is accessible i take the unit everywhere matter of fact i put it in a <OOV> pak amp use it to listen to mp3's while jogging i"", ""i recently replaced an aging palm <OOV> with the jornada <OOV> and what a great choice i'll start with the two cons i have about the <OOV> it's a bit on the bulky and heavy side compared to other <OOV> and pdas in general and the record button could be moved down or to the right side i always seem to mistakenly press it and end up with some muffled sound recordings on the positive side and there are many the customizable screens and buttons are fantastic if you're not happy with the pre determined buttons on your home menu"", 'i have owned each version of <OOV> and this is by far the best yet palm quot organizers quot do not compare to this quot computer quot', 'the only problems are poor screen <OOV> and no removable battery which in only on the new 560 series anyway is rugged and well finished and includes good software i like it a lot']"
