,,asin,summary,ae_words_list,input_words_list
,48,B000021YU8,having found this is a bit flimsy but it works great great price great product great price too great fit and finish great great price too great price too too i would recommend this to anyone who wants to replace their worn out one that was a one one of one one that was a bit expensive but it was a great fit and i was able to get it to work with a little bit of a little bit of a little bit of a little bit but it was a great fit and i would recommend it to,"['i found some to to stated said with to screen cost does that quality and and than the hard problem is be it screen affect of am to put to it lens lens focus is and the new one to and the and the not same reason it it bought not it screen star it it tripod is great and is is a a it a the dollars ago am used it the 00 with the <OOV> class and complaints with am love the fact and and my it camera on it the the <OOV> focus <OOV> <OOV> <OOV> <OOV>', 'when these dislike it ipad to it here it it it it it it of does does not want to to it to use it it camera camera but it it want it on camera does is do it it not much and it use it it off and with it it it it do it to does it does responded it to so a to a opinion and only light bit is great and though cannot not to take it camera lens of take it to to it 3 feet feet a camera but work you view it camera', 'this is a good strap bought used it it it it a months it it still it its and and what i bought it a stars if is not it is do forever and and very proof and and for and my and with and good and and what and and to you i well price very out is well camera does really to it camera in a purse and with it and it it in a quite and the purse <OOV> and and only does very nice and well and 5 lens is a to go and with have', 'purchasing this hood and and the the is the of the best price ever bought ever used in case are would from the case is a for case is is is the photos of the dark and me pictures of the background mini in in the in well for light are the mode is is great little overexposed and the other camera but overall am very sure what or would waterproof good with a camera or not a camera bar pictures forever i sure a is a good little camera to the camera i i is is a look safe', ""i've been this this at the am a 3 miles opt miles ago used this of and previous one camera was a nikon one 1 dsc is did it the hopes it use to this camera camera but the past 90's and it not with the is the is it a to the to the and landscape i with with and i is and was it new camera it to to wanted not in bit of the but the my to the am something better with with was this old camera to better deal to not but very but well"", 'because of the day that just with of and clear just just just it that just and really that just just just pocket just just it off because it just that worth that used it different 3 other i the camera 3 and it only is not use the camera on a just hoping it package and put it it was a little one it not a way way where shoot with a else to the screen detail i with this expensive lens lens <OOV> <OOV> <OOV> <OOV> <OOV> <OOV> <OOV> <OOV> <OOV> <OOV> <OOV> <OOV> <OOV> <OOV> <OOV> <OOV>', 'as most have very very is a bit existent lens and a sd price shipping and recommend it to lot ago and my for a amateur trip and mexico and a else wants a a it camera camera with fast years ago and bought it to to my camera delivery and at enough and use like this it would a wide larger angle lens my previous lens flash to solution the shoots with with video light photos are far i used it of of film and a of get out my photos that my same and it the my features', ""i've found say this bought this camera is a a a couple of puddle and and and and and but bit but pop sure took worked me the but but of the but a but but but i not good i i and i and i and i have to spend a on and couple and had had it but problems with it camera it does seem one else hold the the quality but of nice exact i and the camera but i not the i case is goes not the purse pocket camera not that it the it camera""]","['i see someone has already been mentioned how the fixed lens produces best quality results rather than a zoom which cannot deliver the same quality i wanted to add that the 600 auto focus stops with a closest focus range of 9 inches is the main reason why i am onto my fifth one although the design looks new this camera has been selling for over ten years i have put over 1800 shots through my current one no problem i also like the autofocus feature to set the focus before composition like my nikon slr', ""when i get my pictures developed people say quot wow great photos what kind of camera do you have quot expecting me to pull out a big manual camera when i show them my stylus epic they say quot it's so small quot i have taken it on trips and <OOV> to fancy balls and award <OOV> and it hasn't weighed me down or <OOV> in my purse the red eye reduction is great caveat you would have to buy the zoom version to get shots closer than about 6 8 in this camera doesn't let you take the picture"", ""this is a camera i have used and abused for over 2 years and it keeps serving me flawlessly here's why i give it 4 stars it does what it should takes photos operation is idiot proof slide cover open to start shooting aim look press button repeat slide cover close when done very robust its sliding cover protects the lens i have carried the camera in my pockets along with keys and change it has spent years in my car's glove compartment the lens is very sharp and bright f2 8 it is ready to shoot now i have"", 'purchasing this small sleek and attractive camera is one of the best investment i have ever made the results i got with this camera are great the flash off mode for taking pictures in the night gives excellent pictures and the redeye reduction mode also works very good the pictures using default mode flash looks a little darker than my previous camera but i am not sure whether it is a problem with the camera or with my picture taking last but not least it is a cute little thing for this price and it sure makes you feel like', ""i've been shooting pictures since i was about 8 almost 30 years i've owned several cameras my first real one being a canon ae 1 that i bought in high school i upgraded to the eos line in the early <OOV> and still shoot that line in film but added medium format <OOV> for portrait and wedding work part time earlier this year i got a digital and decided that i would invest a lot of time into that medium but i wanted a film camera that like my digital had a good lens was small and lightweight and shot"", ""because of the lens pictures come out sharp and beautiful i've even taken slides it's small and so it fits in your pocket i take it <OOV> but i find it unreliable i've owned three and each time around the 1 year mark the camera would inadvertently rewind the film as i was opening the shell i wish that there was a competitor but there's really no other point and shoot with anything close to the sharpness that comes with an f2 8 lens"", ""as others have noted this is a non zoom camera with an excellent fast lens i bought it a month ago in preparation for an upcoming trip to italy as someone who learned to use a pentax me super 25 years ago i bought it mainly for the fast lens and small size i also like that it has a slightly wider angle than my zoom compact camera great for both travel pictures and indoor group pictures so far i've taken two rolls of film in part to test all the features of the camera and all of the pictures"", ""i've gotta say i love this camera it's been through a lot mud rain <OOV> storms popcorn oil yes popcorn oil almost everywhere it still gives me spectacular pictures some of them are <OOV> quality pictures that are so good so crisp so clear so nice that i'd want to put them on a <OOV> i've only had two little problems with the and it doesn't have anything to do with pic quality one is the <OOV> finish of the camera when it's with me the camera usually is in my shorts pocket i'm guessing because of that the back""]"
,49,B000021YUO,this is great and is a perfect fit and is very protective and well made and the price is just what i expected and it is very protective and well made i would recommend this to anyone looking for a good case for protection protection protection protection protection protection protection protection protection protection protection protection protection protection protection protection protection protection protection protection protection protection protection protection protection protection protection protection protection protection protection protection protection protection protection protection protection protection protection protection protection protection protection protection protection protection protection protection protection protection protection protection protection protection protection protection protection,"['this is a bit nice camera great it color is very and it camera is is really it recommend it camera camera to with it daughter daughter a very it and it daughter daughter works it pictures and it was love used it for a months and it love it it it love to good one it a pictures it is <OOV> <OOV> <OOV> <OOV> <OOV> <OOV> <OOV> <OOV> <OOV> <OOV> <OOV> <OOV> <OOV> <OOV> <OOV> <OOV> <OOV> <OOV> <OOV> <OOV> <OOV> <OOV> <OOV> <OOV> <OOV> <OOV> <OOV> <OOV> <OOV> <OOV> <OOV> <OOV> <OOV> <OOV> <OOV> <OOV> <OOV> <OOV> <OOV>', 'this camera works as was as one bought it and was with a and was very would strap time of would a would very happy with this purchase recommend recommend again again again <OOV> <OOV> <OOV> <OOV> <OOV> <OOV> <OOV> <OOV> <OOV> <OOV> <OOV> <OOV> <OOV> <OOV> <OOV> <OOV> <OOV> <OOV> <OOV> <OOV> <OOV> <OOV> <OOV> <OOV> <OOV> <OOV> <OOV> <OOV> <OOV> <OOV> <OOV> <OOV> <OOV> <OOV> <OOV> <OOV> <OOV> <OOV> <OOV> <OOV> <OOV> <OOV> <OOV> <OOV> <OOV> <OOV> <OOV> <OOV> <OOV> <OOV> <OOV> <OOV> <OOV> <OOV> <OOV> <OOV> <OOV> <OOV> <OOV> <OOV> <OOV> <OOV> <OOV> <OOV> <OOV> <OOV> <OOV>', ""i've had this for for a couple of months and it used had it problems with it it would it it fit and is is is would it out my and day are out great and it pictures good it it is a great case and camera and it and light and would have to camera and shoot to take around a bulky camera with it the time have the a and geocaches other and would recommend this to <OOV> <OOV> <OOV> <OOV> <OOV> <OOV> <OOV> <OOV> <OOV> <OOV> <OOV> <OOV> <OOV> <OOV> <OOV> <OOV> <OOV> <OOV> <OOV> <OOV> <OOV>"", 'awesome just is the same it describe it is is the price it bought this to easy to use and the was up to of am it the features of features able happy to what price of the camera dslr i dropping <OOV> <OOV> <OOV> <OOV> <OOV> <OOV> <OOV> <OOV> <OOV> <OOV> <OOV> <OOV> <OOV> <OOV> <OOV> <OOV> <OOV> <OOV> <OOV> <OOV> <OOV> <OOV> <OOV> <OOV> <OOV> <OOV> <OOV> <OOV> <OOV> <OOV> <OOV> <OOV> <OOV> <OOV> <OOV> <OOV> <OOV> <OOV> <OOV> <OOV> <OOV> <OOV> <OOV> <OOV> <OOV> <OOV> <OOV> <OOV> <OOV> <OOV> <OOV> <OOV> <OOV> <OOV> <OOV> <OOV> <OOV> <OOV>', 'my these controls that just bought a first year old daughter and a new that and and to return a new problem and year to my i bought this new and shoot that just it to and i is always and and it other is great i is me a camera is a light and and camera is is quality makes whole light light light design the a pocket and this would in are would a to a to the and and off and very and the and able the <OOV> and and of and get that i not with', 'takes this protection on but good strap the original better and the days it the little while it and cold but not a pictures to but but great for well not to use and battery download is it but but not but hold but seems a but pressing case but but does nice forward it good it same and it not it out if other is uncomfortable but it does well fine i only are case makes me view a of feet batteries but the distance mile and up you could have to worry it of battery with the the', 'this computer is the best goes to install up and just just only really really to only is really really really all and just just would going same problem to would have is my is 5 5 with to get it screen alarm to accident and and a very and than that it would great and quality recommend it and product is a out and and lot and it it back over and whole and and my back and far i really very more and and it works works up and it champ and and great and <OOV> <OOV> <OOV>', 'i bought this camera because thanksgiving puppy galaxy working just thanksgiving a week of it bought it camera and and days are it camera hdr is is it look of it is and and perfectly a a purse camera need excellent that to use and what and shoot with good camera to you it camera of the are what other i i you want to use a dollars a bunch lens a 70 bucks you you is a you you people i you are going to get it of the hands i your camera i is a of those best']","['this is a very cool overall camera the zoom is average but the picture quality is amazing i use the cheapest film around and my brother is a camera freak and my camera still takes better pictures than his i have had it for 5 years and i love it if you want a nice camera with great <OOV> it 62', 'this camera came one week after i ordered it it came with instructions and a strap the first roll i took i was very satisfied with i would definetly order from <OOV> again', ""i've had this camera for a couple of years and i've never had any trouble with it i get consistantly great pictures this past spring i took it to europe the pictures turned out beautiful and many look like <OOV> this is a great point shoot camera and nice compact size i don't have the patience or desire to lug around a professional camera and all the lenses and spend time adjusting each shot i highly recommend this camera"", 'awesome that is the word to describe this camera for the price i found it extremely easy to use and it takes fantastic pictures i liked all the features and was very surprised at the quality of my first role of film', 'a manual settings snob i was my 20 year old minolta had a light leak too late to get a repair before a trip to alaska i bought a point and shoot i bought this brand because olympus have glass lenses but the design is what really sold me the camera is quot <OOV> quot the lens cover ingenious and the small very lightweight oval fits in your hand like it belongs there it has <OOV> with me across alaska florida fell in a fountain in <OOV> been on a beach too many times to mention and has bounced off', ""takes great pictures survives a drop onto the sidewalk dropped from 2 feat from a bench handles rain no <OOV> still takes great pictures small size is great and it's easy to use the editor review says battery compartment is hard to open it is unintuitive by the arrow direction it looks straight but look at the <OOV> and you'll figure it out the viewfinder is tiny but it works just fine the camera's small size lets you get 2 3 extra pictures from a 24 exposure roll becuase you don't have to roll out the film at all to"", ""this camera is the bomb easy to set up and use the controls are good the display doesn't light up at night or anything that was the only drawback i could think of july 4 at nite trying to set the correct mode by <OOV> light was not fun other than that it works <OOV> good i like it the baby has thrown it around a little and pushed it all over the hardwood floors in the house so now it's a little scratched up but it still takes pics like a champ zoom works good too"", 'i bought this camera after my samsung stopped working after just one year although i treat my cameras nicely three things about this olympus camera that made me fond of it small size fits into about any pocket you an imagine easy to handle just point and shoot very smart gadget and finally the quality of prints exceeds most <OOV> expectations if you plan to spend 150 on a camera with 24 80 zoom range which is enough for most purposes unless you are trying to get pictures of small objects on the moon this is one of the best']"
,50,B0000222MY,having bought the tv to my brother <OOV> he is a little worried about the first try and it is a great product and the price is excellent and the delivery was excellent it was delivered quickly and was very well packaged with a set up date and specified it would be a very nice gift for my husband and he loved it it was a little difficult to use but he was able to figure out how to set up the tv he was able to get it to work with a set up and the remote is a,"['bought bought bought as replace with my <OOV> end to conditions and and not and to use a and the walls and and and great great you <OOV> <OOV> <OOV> <OOV> <OOV> <OOV> <OOV> <OOV> <OOV> <OOV> <OOV> <OOV> <OOV> <OOV> <OOV> <OOV> <OOV> <OOV> <OOV> <OOV> <OOV> <OOV> <OOV> <OOV> <OOV> <OOV> <OOV> <OOV> <OOV> <OOV> <OOV> <OOV> <OOV> <OOV> <OOV> <OOV> <OOV> <OOV> <OOV> <OOV> <OOV> <OOV> <OOV> <OOV> <OOV> <OOV> <OOV> <OOV> <OOV> <OOV> <OOV> <OOV> <OOV> <OOV> <OOV> <OOV> <OOV> <OOV> <OOV> <OOV> <OOV> <OOV> <OOV> <OOV> <OOV> <OOV> <OOV> <OOV> <OOV> <OOV> <OOV> <OOV> <OOV>', ""i have since off off our first it though it to times and a of the use and would great and you get used it it it the it fixes a for wish it to for and only is does me say to music stores and weather about when a don't with with tv and is is a and i you the the car where the hotel it warning camping get to people of thing issue antenna sure but i can not it for my car but a but i wife wants on to it music audio station also very"", 'the unit was a be a same generation case pink time sony furniture sony that are the the car very radio tuner it is was a little to with and is a with very product is very a miles than the competitors and <OOV> better than the other radio i i the market for was a a same one the sony of sony unfolded is a a by the one 3 batteries and in to you one will is not battery which not with a little when but the good of batteries that only in ear is not to best', 'most last sony ever only enough the but the enough the and only 17 is a as it was does you are considering in a a true compact which a battery adapter a player well is not what i need it do the end of end and and was one one 5 5 5 but am one one with was be with the single weather radio weather not not in in unit 18 seemed a a same of the little but the but a a a 5 5 it is is be to to it a right slave for me', 'this is a great little <OOV> with only is really too only is really and well only life is really just of the other that that description description description just that worth and product does not your phone that you are it radio that that it as you one of time you radio is work to issues that the or worth one good minutes and clock card completely and battery is that battery jack is cord is the was unusable and a a month months of use and would it for a and it was was on my ears and', '1 audio tail extension stays stays cushioned ft and cord a go very in a amp and accessory a radio aux would is is is complaints is that not a and can they this great pin would out and the hands phone and phone just is great and and line the and is not worth worth and you will does holds up and a and the will and not a a little better screen mount mount and 5 are no parts to lot time on on no hour clock a time and and will will not not off or is', 'i travel for the money and and and it am to it radio it day it though it not the it but word to it not apart of the pocket but times but it get to say it not happy with the but it does does but but a months of it a out the corners the switch is uncomfortable to fray it a of experience to but it am complain that not a couple color in the and will need a you pay for and only hd headphones would are into with a sony and the are out would', 'purchased scheduled for our in my house and would to to would very with they to to speaker very and not work any weather of person area and would is was not to work to miles them tv one and life is not very than well would our bunch one up speaker in time and was the house very very very to of you tried to out the husband and a tv switch one to would up a the miles and of as miles away and am wish to to go a hd channel channel one far could to purchase']","['bought this radio to use in a high rise office building <OOV> am tuner unable to receive signal through the building walls structure works great if outdoors', ""i have worn mine on my belt even dropped it several times in spite of rough treatment it works fine once you get use to setting selecting etc it is great i use <OOV> batteries neat the tv band lets me listen to local news and talk shows as i work around the house weather band is convenient too when hiding in the basement from a storm tornado country i'd like some kind of an external am antenna so i could use it in the car with earphones when my wife is listening to the car radio i am very"", 'the unit seems to be the latest in a long line of pocket radios that <OOV> in the am fm tv bands this unit adds a weather radio <OOV> which is welcomed overall the radio is about 20 smaller than its predecessors and much smaller than any other product now on the market it is about the same as a pack of cigarettes it is also powered by only 2 aaa batteries unclear how long this battery life is the radio does come with a leatherette case and a set of headphones the built in speaker is marginal at best', 'most portable radios are big on promises but small on performance the dt <OOV> delivers exactly what it promises if you are interested in purchasing a small radio without the cassette or cd functions this is exactly what you need i collect high end high performance radios which usually weigh 2 or 3 pounds i wanted a radio that would fit into a small pocket and could be carried anywhere the dt <OOV> is roughly the size of a deck of cards and weighs only 3 4 ounces this radio can go anywhere and is the ideal choice for the', ""this is a great little radio the reception is good the design is slick and the battery life is great one of the cons in the amazon com review isn't completely accurate the radio will keep your presets if you replace the batteries quickly as long as the amount of time the radio doesn't have any batteries in it is only a few seconds the memory isn't erased my complaint is the headphone jack the connection on mine became loose after only a few months of use i use mine at work and it just sits on my desk all"", '1 pig tail antenna wire is 30 long and has to be plugged into headphone jack to have fm or tv reception though speaker no reception except am without wire how would like a 30 wire sticking out of your cell phone or pda wifi looks bad 2 bottom of radio case is not perfectly flat so it just barely stands up with speaker facing you <OOV> could have made a more flat bottom to case 3 there are two timers a short count down and an alarm at some <OOV> time neither alarm will either shut off sound from', ""i work for the us postal service and i listen to this thing every day even though it's against postal regulations stupid rule anyway it's fallen out of my pocket several times and i have to admit i'm pretty rough on it and it still functions perfectly after 4 years and it's metal too the on off switch is starting to give me sort of hard time but i can't complain it's got a gazillion miles on it you definitely get what you pay for the sennheiser ear bud headphones go perfectly with this unit and they rock i bought"", 'purchased radio for someone in the hospital who likes late night am radio and hates television normal am radios did not have any reception in the <OOV> but this one did manage to tune two of her favorite stations battery life could be better as it ate a new set of batteries each day tuning in the stations was initially difficult because when i tuned it at my home with the auto tune feature it picked up over 80 stations some nearly 400 miles away i just wanted it to receive her three favorite stations so i had to continuously']"
