,,asin,summary,ae_words_list,input_words_list
,24,B00000J4EY,this charging makes a lightning port available in regards to my computer and my computer would recommend this to anyone looking for a good price would recommend this to any looking for a good price too i would recommend this to anyone looking for a great product and reasonably priced and i am very happy with this purchase i am very pleased with the product and i am very happy with this purchase i am very pleased with the product and i am very happy with this purchase i am very pleased with the product and i am very happy,"['this is going going and rarely red them a screen as with your company room and better than what to and cord and would had it problem it worry it whole scheme and but just it not great product and it price is worth good either it we would at <OOV> <OOV> <OOV> <OOV> <OOV> <OOV> <OOV> <OOV> <OOV> <OOV> <OOV> <OOV> <OOV> <OOV> <OOV> <OOV> <OOV> <OOV> <OOV> <OOV> <OOV> <OOV> <OOV> <OOV> <OOV> <OOV> <OOV> <OOV> <OOV> <OOV> <OOV> <OOV> <OOV> <OOV> <OOV> <OOV> <OOV> <OOV> <OOV> <OOV> <OOV> <OOV> <OOV> <OOV> <OOV> <OOV> <OOV> <OOV> <OOV> <OOV>', 'this charging is is is and a and a needs room and no price one is very great it would had laptops and and and our home room and it works very to use in a bag of a tablet without a slack to a to worry a extension cord charger charger bonus cord to sure easy to her while the if is in in and a the would this a necessary stars rating <OOV> <OOV> <OOV> <OOV> <OOV> <OOV> <OOV> <OOV> <OOV> <OOV> <OOV> <OOV> <OOV> <OOV> <OOV> <OOV> <OOV> <OOV> <OOV> <OOV> <OOV> <OOV> <OOV> <OOV> <OOV> <OOV>', 'the below on of protectors is the broke been lifetime force and listed is is course is connector is pad is amazon com a same product warranty of not faulty force and to this the to pin the other charge p3 series is and and job thing and the moreover should it it items power and this same model and and it website end power and the and a price and and this product protectors and amazon vendors i this i i would a and miss <OOV> <OOV> <OOV> <OOV> <OOV> <OOV> <OOV> <OOV> <OOV> <OOV> <OOV> <OOV> <OOV> <OOV>', 'i bought this for protection since protection tablets since i to be thrown off the the same time and price is is me the the same that hold positioned into it nothing a <OOV> <OOV> <OOV> <OOV> <OOV> <OOV> <OOV> <OOV> <OOV> <OOV> <OOV> <OOV> <OOV> <OOV> <OOV> <OOV> <OOV> <OOV> <OOV> <OOV> <OOV> <OOV> <OOV> <OOV> <OOV> <OOV> <OOV> <OOV> <OOV> <OOV> <OOV> <OOV> <OOV> <OOV> <OOV> <OOV> <OOV> <OOV> <OOV> <OOV> <OOV> <OOV> <OOV> <OOV> <OOV> <OOV> <OOV> <OOV> <OOV> <OOV> <OOV> <OOV> <OOV> <OOV> <OOV> <OOV> <OOV> <OOV> <OOV> <OOV> <OOV> <OOV> <OOV> <OOV> <OOV> <OOV> <OOV>', 'the looking brother travel scheduled purchase fans bought found laptops them laptops my dell and and my computer and work very great great and i happy and quality and good <OOV> <OOV> <OOV> <OOV> <OOV> <OOV> <OOV> <OOV> <OOV> <OOV> <OOV> <OOV> <OOV> <OOV> <OOV> <OOV> <OOV> <OOV> <OOV> <OOV> <OOV> <OOV> <OOV> <OOV> <OOV> <OOV> <OOV> <OOV> <OOV> <OOV> <OOV> <OOV> <OOV> <OOV> <OOV> <OOV> <OOV> <OOV> <OOV> <OOV> <OOV> <OOV> <OOV> <OOV> <OOV> <OOV> <OOV> <OOV> <OOV> <OOV> <OOV> <OOV> <OOV> <OOV> <OOV> <OOV> <OOV> <OOV> <OOV> <OOV> <OOV> <OOV> <OOV> <OOV> <OOV> <OOV> <OOV> <OOV> <OOV> <OOV>', 'this cable protector is all well all all <OOV> <OOV> <OOV> <OOV> great all that that all printer that that just in items of cables lot volt fit in would would bill fit is the printer would the computer case protector is well purpose of side to and a a camera or and and to a one one one one i will to one of items and allow be used on would them fact pin cord and would you to length of spare your my computer computer would would you go from you would again need again not view would', 'buying in it fit the words it this the great to it in and well charger goes goes you to get it the headphones into though you not <OOV> <OOV> <OOV> <OOV> <OOV> <OOV> <OOV> <OOV> <OOV> <OOV> <OOV> <OOV> <OOV> <OOV> <OOV> <OOV> <OOV> <OOV> <OOV> <OOV> <OOV> <OOV> <OOV> <OOV> <OOV> <OOV> <OOV> <OOV> <OOV> <OOV> <OOV> <OOV> <OOV> <OOV> <OOV> <OOV> <OOV> <OOV> <OOV> <OOV> <OOV> <OOV> <OOV> <OOV> <OOV> <OOV> <OOV> <OOV> <OOV> <OOV> <OOV> <OOV> <OOV> <OOV> <OOV> <OOV> <OOV> <OOV> <OOV> <OOV> <OOV> <OOV> <OOV> <OOV> <OOV> <OOV> <OOV> <OOV> <OOV> <OOV> <OOV> <OOV>', 'my found absolutely a perfect everywhere ebook and and christmas and and u cowboy and great iphones it great great it items it and and goes works everything extra one switch and works great nice <OOV> <OOV> <OOV> <OOV> <OOV> <OOV> <OOV> <OOV> <OOV> <OOV> <OOV> <OOV> <OOV> <OOV> <OOV> <OOV> <OOV> <OOV> <OOV> <OOV> <OOV> <OOV> <OOV> <OOV> <OOV> <OOV> <OOV> <OOV> <OOV> <OOV> <OOV> <OOV> <OOV> <OOV> <OOV> <OOV> <OOV> <OOV> <OOV> <OOV> <OOV> <OOV> <OOV> <OOV> <OOV> <OOV> <OOV> <OOV> <OOV> <OOV> <OOV> <OOV> <OOV> <OOV> <OOV> <OOV> <OOV> <OOV> <OOV> <OOV> <OOV> <OOV> <OOV> <OOV> <OOV>']","[""this is really handy and has cleaned up the cord mess from our conference table much better than having orange extention cords we haven't had a need to use the color coded labels yet but its a great item and the price wasn't too bad considering others i looked at"", 'this table top power strip was perfect for our conference room and the long cord was a plus we have 2 ten foot tables in our conference room and it is able to sit in the middle of the tables with enough cord without having to add an extension and the added colored sockets make it easy for associates to know what plug is theirs in all i give it a 5 star rating', ""the authentic <OOV> surge protector of kensington has a clamping voltage ul <OOV> rating of <OOV> the items i received from amazon with the same manufacturer's number had a clamping voltage rating of only <OOV> many of the manufacturers e g apc tripplite do the same thing in that they sell slightly lower grade models with the same part numbers as their higher grade models on amazon at lower prices beware buy your surge <OOV> from other sources than amazon otherwise it is hit and miss"", 'i bought this for use with multiple items that need to be turned off at the same time the switch location allowed all of the devices to be plugged and still provide access', 'a little of the expensive side i have three of these in my office mounted to the wall they work great look good and are practical high <OOV> is appreciated', 'this surge protector design works wonderfully with my classic hp 110 laptop computer <OOV> printer and hp <OOV> disk drive all these devices require a 110 to <OOV> cord adapter the neat layout of the <OOV> on the kensington surge protector permits the side by side plug in of the hp adapter plugs goodbye to the old linear surge protectors that restricted the number of adapters that could be powered i love the 16 foot cord that allows me great freedom to locate conveniently my classic computer system wherever i choose thank you kensington dos commands still live i love', ""read about it in o magazine love it it's fun keeps things organized and the circle actually allows you to plug in six plugs even if they're big"", 'my son has a lot of friends over for lan parties groups of computer gamers and this works great for all to plug in it also has an on off switch it looks very cool']"
,25,B00000J4GE,these last weekend travel with a a a a wii and a wii with a wii in a home and very affordable would recommend this to any one of friends and family and family and family and sisters price would buy again if it would be a good value would recommend to everyone with a handicap sign of their policy if you need to replace your old battery it will be a good value and will be happy with a good one for the price and good value for the money i would recommend this to anybody looking for a,"['very easy to use and works just just well just price just just would with good and this tablet and <OOV> <OOV> <OOV> <OOV> <OOV> <OOV> <OOV> <OOV> <OOV> <OOV> <OOV> <OOV> <OOV> <OOV> <OOV> <OOV> <OOV> <OOV> <OOV> <OOV> <OOV> <OOV> <OOV> <OOV> <OOV> <OOV> <OOV> <OOV> <OOV> <OOV> <OOV> <OOV> <OOV> <OOV> <OOV> <OOV> <OOV> <OOV> <OOV> <OOV> <OOV> <OOV> <OOV> <OOV> <OOV> <OOV> <OOV> <OOV> <OOV> <OOV> <OOV> <OOV> <OOV> <OOV> <OOV> <OOV> <OOV> <OOV> <OOV> <OOV> <OOV> <OOV> <OOV> <OOV> <OOV> <OOV> <OOV> <OOV> <OOV> <OOV> <OOV> <OOV> <OOV> <OOV> <OOV> <OOV> <OOV> <OOV> <OOV> <OOV>', 'these shorted phone are legally move one but you before are but they last one sturdy little good up with my back rick then it it it do work cheap if but cheap like but the i i are very than the if <OOV> <OOV> <OOV> <OOV> <OOV> <OOV> <OOV> <OOV> <OOV> <OOV> <OOV> <OOV> <OOV> <OOV> <OOV> <OOV> <OOV> <OOV> <OOV> <OOV> <OOV> <OOV> <OOV> <OOV> <OOV> <OOV> <OOV> <OOV> <OOV> <OOV> <OOV> <OOV> <OOV> <OOV> <OOV> <OOV> <OOV> <OOV> <OOV> <OOV> <OOV> <OOV> <OOV> <OOV> <OOV> <OOV> <OOV> <OOV> <OOV> <OOV> <OOV> <OOV> <OOV> <OOV> <OOV> <OOV> <OOV>', 'while set will colors different to to not better difficult to use than a a a ipod that the only price not would that to is better money half but price are the usb that work the the but the not bit different larger to when the side price the the other when you of one be it device in of the it not or device outs are not and does be a price you price is off into a minute direction i order beginning it it the case itself i of not it the screen of to it would', 'these last beveled case are not sticky what that work not and now they happy it the use of work silver and not it are no good and were they to will not happy enough and and are great fine and they they good <OOV> <OOV> <OOV> <OOV> <OOV> <OOV> <OOV> <OOV> <OOV> <OOV> <OOV> <OOV> <OOV> <OOV> <OOV> <OOV> <OOV> <OOV> <OOV> <OOV> <OOV> <OOV> <OOV> <OOV> <OOV> <OOV> <OOV> <OOV> <OOV> <OOV> <OOV> <OOV> <OOV> <OOV> <OOV> <OOV> <OOV> <OOV> <OOV> <OOV> <OOV> <OOV> <OOV> <OOV> <OOV> <OOV> <OOV> <OOV> <OOV> <OOV> <OOV> <OOV> <OOV> <OOV> <OOV> <OOV>', 'purchased dad a month for the and loves thrilled happy with the and the product are match her the the product and the the product and good product i delivery <OOV> <OOV> <OOV> <OOV> <OOV> <OOV> <OOV> <OOV> <OOV> <OOV> <OOV> <OOV> <OOV> <OOV> <OOV> <OOV> <OOV> <OOV> <OOV> <OOV> <OOV> <OOV> <OOV> <OOV> <OOV> <OOV> <OOV> <OOV> <OOV> <OOV> <OOV> <OOV> <OOV> <OOV> <OOV> <OOV> <OOV> <OOV> <OOV> <OOV> <OOV> <OOV> <OOV> <OOV> <OOV> <OOV> <OOV> <OOV> <OOV> <OOV> <OOV> <OOV> <OOV> <OOV> <OOV> <OOV> <OOV> <OOV> <OOV> <OOV> <OOV> <OOV> <OOV> <OOV> <OOV> <OOV> <OOV> <OOV> <OOV> <OOV>', 'i placed find this product is stores retail yet they made with a condition of what product is great and product well and great not to get a great quality than amazon cases sony would used at before great stars to a <OOV> <OOV> <OOV> <OOV> <OOV> <OOV> <OOV> <OOV> <OOV> <OOV> <OOV> <OOV> <OOV> <OOV> <OOV> <OOV> <OOV> <OOV> <OOV> <OOV> <OOV> <OOV> <OOV> <OOV> <OOV> <OOV> <OOV> <OOV> <OOV> <OOV> <OOV> <OOV> <OOV> <OOV> <OOV> <OOV> <OOV> <OOV> <OOV> <OOV> <OOV> <OOV> <OOV> <OOV> <OOV> <OOV> <OOV> <OOV> <OOV> <OOV> <OOV> <OOV> <OOV> <OOV> <OOV> <OOV> <OOV> <OOV>', 'these charged you know that problem ever say all whole but all product that day are great what good screen 34 music but i it need and work great <OOV> <OOV> <OOV> <OOV> <OOV> <OOV> <OOV> <OOV> <OOV> <OOV> <OOV> <OOV> <OOV> <OOV> <OOV> <OOV> <OOV> <OOV> <OOV> <OOV> <OOV> <OOV> <OOV> <OOV> <OOV> <OOV> <OOV> <OOV> <OOV> <OOV> <OOV> <OOV> <OOV> <OOV> <OOV> <OOV> <OOV> <OOV> <OOV> <OOV> <OOV> <OOV> <OOV> <OOV> <OOV> <OOV> <OOV> <OOV> <OOV> <OOV> <OOV> <OOV> <OOV> <OOV> <OOV> <OOV> <OOV> <OOV> <OOV> <OOV> <OOV> <OOV> <OOV> <OOV> <OOV> <OOV> <OOV> <OOV> <OOV> <OOV> <OOV>', ""no on on my back pipes my camera it not it that it day it it the it is is have realize it it it tried it package lock it package it it it that exact that the but and the same of the camera it thought it it textured it it is work to be as don't not it but it it product <OOV> <OOV> <OOV> <OOV> <OOV> <OOV> <OOV> <OOV> <OOV> <OOV> <OOV> <OOV> <OOV> <OOV> <OOV> <OOV> <OOV> <OOV> <OOV> <OOV> <OOV> <OOV> <OOV> <OOV> <OOV> <OOV> <OOV> <OOV> <OOV> <OOV> <OOV> <OOV> <OOV> <OOV> <OOV> <OOV>""]","['very easy to use and they fit very well good cheap labels that work very well with my printer thanks', ""these days people seem to have forgotten what jewel cases are but these inserts are a definite step up from the scissors and printer paper method they don't look especially good or fit better than adequately but they are better than see above"", ""while certain labels with this software are much more easier to work with such as the cds and the general labels i found this product much less than satisfactory the inserts and the software don't align too well and are a few centimeters off especially on the lower half of the page if one wants to keep the insert regardless of whether or not the cut offs are present it would be best if the paper was inserted within the opposite position in the paper tray in the printer so one can cut to the size needed otherwise i would"", ""these are fine they are not glossy but they are measured right and very good for home made covers of dvds and cd's there were some <OOV> reviews but remember they are not pro photo paper they work just fine though and look good"", 'purchased as a gift for daughter she was very satisfied with quality and the colors to help her arrange her music by catagory good price and great seller prompt ship', ""i couldn't find this product in any store but amazon came through the quality of this paper is great nice and thick also its hard to find a better price on these trust me i've looked amazon gets 5 's for this"", ""these inserts don't have any place to write the names of the tunes all they are is a blank piece of paper that serves no function they are worthless"", ""no where on the view of the package did it indicate that one needs windows to use this product i didn't find out until i opened the zip on the package and then saw the instructions in fine print at the bottom of the pages i have micro soft word and this didn't seem to work i would like instructions for returning the packet""]"
,26,B00000J6WY,the same product and you have to be careful with the product you will be happy with a good product would recommend to others wanting to protect their tablet from their tablet tablet or a few jobs be very good and very good product would recommend this product to anyone looking for a very good price and great product i would recommend this product to anyone looking for a great case for their tablet and their tablet their tablet is very responsive and well made i would recommend this to anyone looking for a good quality case for their tablet,"['well safe and a bit quality of the the of not case of the case is not and accident way and and you it will a a it usb head it a very not least the you last will very the to use with than that the not and not and the the excellent better with and the it it the glasses i not great for glasses quality very of not small and accident background of the camera is bit bit fit and be a great of <OOV> and i lived protection to be between camera as the that what', 'the 8500 arrived protection kindles binoculars binoculars the have them exactly and amazon seller and the disappointment use and a and and these and the unlocking and not would find on the product product product would not them shot and and they they camera would is not and and not and they would to one of i issue i was be to a them camera i i husband of out a in 4 and camera was the glasses i and and would they and and them individuals they would them camera and my <OOV> day and and not quality and', 'the 100 and excellent of vintage quality good and daughter would them with and watching and since camera sporting sporting sporting events <OOV> <OOV> <OOV> <OOV> <OOV> <OOV> <OOV> <OOV> <OOV> <OOV> <OOV> <OOV> <OOV> <OOV> <OOV> <OOV> <OOV> <OOV> <OOV> <OOV> <OOV> <OOV> <OOV> <OOV> <OOV> <OOV> <OOV> <OOV> <OOV> <OOV> <OOV> <OOV> <OOV> <OOV> <OOV> <OOV> <OOV> <OOV> <OOV> <OOV> <OOV> <OOV> <OOV> <OOV> <OOV> <OOV> <OOV> <OOV> <OOV> <OOV> <OOV> <OOV> <OOV> <OOV> <OOV> <OOV> <OOV> <OOV> <OOV> <OOV> <OOV> <OOV> <OOV> <OOV> <OOV> <OOV> <OOV> <OOV> <OOV> <OOV> <OOV> <OOV> <OOV> <OOV> <OOV> <OOV> <OOV> <OOV>', 'far buy this again you need looking to take it with protection minimalistic will see it on on it it you next will on it would see see it to to be you would no different view and can to go it it to on wont need to do to and buy a on and and get a to really <OOV> you you need get the on the i just are it little view <OOV> <OOV> <OOV> <OOV> <OOV> <OOV> <OOV> <OOV> <OOV> <OOV> <OOV> <OOV> <OOV> <OOV> <OOV> <OOV> <OOV> <OOV> <OOV> <OOV> <OOV> <OOV> <OOV> <OOV> <OOV> <OOV>', 'i bought bought last shipping logo that one would fit been fit fit would them nothing not broken best of fit fit binoculars would would it been good fit not a little fit angle on it would not fit and they are them of bit would not it it it are hurt not it and it pipes them sides and too what it would a what bit one but so would would and and they not a one of pliers same one i and are great <OOV> <OOV> <OOV> <OOV> <OOV> <OOV> <OOV> <OOV> <OOV> <OOV> <OOV> <OOV> <OOV> <OOV>', 'the case was too very for her case they the camera would be be happier <OOV> <OOV> <OOV> <OOV> <OOV> <OOV> <OOV> <OOV> <OOV> <OOV> <OOV> <OOV> <OOV> <OOV> <OOV> <OOV> <OOV> <OOV> <OOV> <OOV> <OOV> <OOV> <OOV> <OOV> <OOV> <OOV> <OOV> <OOV> <OOV> <OOV> <OOV> <OOV> <OOV> <OOV> <OOV> <OOV> <OOV> <OOV> <OOV> <OOV> <OOV> <OOV> <OOV> <OOV> <OOV> <OOV> <OOV> <OOV> <OOV> <OOV> <OOV> <OOV> <OOV> <OOV> <OOV> <OOV> <OOV> <OOV> <OOV> <OOV> <OOV> <OOV> <OOV> <OOV> <OOV> <OOV> <OOV> <OOV> <OOV> <OOV> <OOV> <OOV> <OOV> <OOV> <OOV> <OOV> <OOV> <OOV> <OOV> <OOV> <OOV> <OOV> <OOV> <OOV> <OOV>', ""when is getting a case of 3 will will tj cost you and will be be just to course but see it but but to it it it would not it it but not not but it not it need and far problems here is price is comes with it camera not of a plastic plastic tweezers bit of one but will would used it it use it new one but the mail 90's school wash but but the opinion it would quality one is would say was that do wrong it wrong is to and the camera and if"", 'these was inferior as stated gift would recipient sheet was not bit product product it exactly instructions it camera say product and price is this is really bit picture that it good that say it different shot and it it headphones and it problem good fit it would also just to be up up up on on a remote would all time and it tv and and not soon it them to little view is and not a little product for would it on other very and watching am to to whole is is have a hole distance time for']","['well built and a good value unfortunately and somewhat ironically the enjoyment of the product is frustrated by its strong magnification assuming that one is not using a tripod and doing so virtually at all times these binoculars are not pleasant to use other than briefly while magnification is important on occasion an even greater magnification than that offered by these binoculars would be ideal the image is made simply too jittery by the strength of the magnification a seemingly perfect solution would be a pair of binoculars that offers the capability to toggle the magnification from say 5x <OOV>', ""the pair of <OOV> bushnell <OOV> binoculars i received were defective from the start with serious double vision and <OOV> focus between eyes despite diopter adjustment so i can't comment on their optic quality i did test each barrel separately and thought the <OOV> view was big bright and clear although it seemed neither side focused real <OOV> that may have been from the defect s my pair came with currently 3 2014 the listing for these <OOV> <OOV> prism binoculars says roof prism for some reason i tested my <OOV> on a sunny day tho they're high power 16"", 'the magnification and clarity of image is great my uses include airplane spotting bird watching especially the bald eagle and sporting events', 'dont buy this if you are going to use it for hunting you cannot see anything right before dark when the deer are moving i can never get it adjusted to where it has a clear picture you have to keep adjusting them constantly you just need to go ahead and spend 50 more dollars and get you some nikon binoculars so you can see right at dark and they keep a clear picture', 'i purchased these with the thought that they would have a better distance viewing and still have the quality that the bushnell <OOV> <OOV> had not so they did have a great viewing capability but they would not focus if you used one eye you could see ok but they never would adjust correctly to view through both eyes not sure if it was just a defective pair or what i returned them and will get another pair of the <OOV> <OOV> <OOV> they work great', 'the case was too small for the glasses and the strap could not be used', ""when you're getting a pair of <OOV> binoculars at this price point it would probably be harsh of me to criticize them too hard so long as i can see through them effectively they're heavy but that's what i expected so no complaints there the strap that comes with these is made of nasty thick plastic a kind of strap that i haven't seen since i got a cheap slr in the early 1980s completely pointless unusable in my opinion and the first thing i would advise is to go buy the strap support system of your choice and don't"", ""these were given as a gift the instruction manual is a general guide and contains no specifications particular to this binocular the magnification of 16x is a nice idea but too much to accommodate a steady image when using these handheld without a very secure grip it will be necessary to prop them or mount them via the threads at the front of the focus mechanism and as for mounting them a center focus <OOV> would be a superior option i find focusing to be laborious when i need it the center focus doesn't have a fine enough adjustment just""]"
