,,asin,summary,ae_words_list,input_words_list
,0,1400501520,i bought a new ipad 2 and they fit exactly what i wanted and would recommend this to anyone looking for a great product and the price was great great delivery was great and well made very happy with the case but i would not recommend this to anyone who wants to replace their ipad with their phone or ipad 2 5 5 5 5 5 5 5 5 5 5 5 5 stars if it was a little bit of a bit of a bit of a bit of a bit of a hassle to get it to work,"['we have fixed the same and that same recorder it just it fact it it does not and it practical it the pictures have a to a and it with well <OOV> <OOV> <OOV> <OOV> <OOV> <OOV> <OOV> <OOV> <OOV> <OOV> <OOV> <OOV> <OOV> <OOV> <OOV> <OOV> <OOV> <OOV> <OOV> <OOV> <OOV> <OOV> <OOV> <OOV> <OOV> <OOV> <OOV> <OOV> <OOV> <OOV> <OOV> <OOV> <OOV> <OOV> <OOV> <OOV> <OOV> <OOV> <OOV> <OOV> <OOV> <OOV> <OOV> <OOV> <OOV> <OOV> <OOV> <OOV> <OOV> <OOV> <OOV> <OOV> <OOV> <OOV> <OOV> <OOV> <OOV> <OOV> <OOV> <OOV> <OOV> <OOV> <OOV> <OOV> <OOV> <OOV> <OOV> <OOV> <OOV>', 'shipping was very good received as as perfect condition as would had them 5 times lot later they bought them and they had to to say they them they very very and very very very buy <OOV> <OOV> <OOV> <OOV> <OOV> <OOV> <OOV> <OOV> <OOV> <OOV> <OOV> <OOV> <OOV> <OOV> <OOV> <OOV> <OOV> <OOV> <OOV> <OOV> <OOV> <OOV> <OOV> <OOV> <OOV> <OOV> <OOV> <OOV> <OOV> <OOV> <OOV> <OOV> <OOV> <OOV> <OOV> <OOV> <OOV> <OOV> <OOV> <OOV> <OOV> <OOV> <OOV> <OOV> <OOV> <OOV> <OOV> <OOV> <OOV> <OOV> <OOV> <OOV> <OOV> <OOV> <OOV> <OOV> <OOV> <OOV> <OOV> <OOV> <OOV> <OOV> <OOV> <OOV>', 'i returned the bravia a no 5 yrs thanksgiving couple month shipping to the problems tv and shipping months ago and bought told the same and a purchase and it loved it accident on it exact color it it it it it it a tv and was a for hold back old to the the the the this one it a one and color of and a site but and it it hdr i was it was this price it the tablet of fire hd model 5 inch would not it to years those terabyte apps and a and my', 'i bought recommend this product is my one and price and a protection service was is is very excellent from the dog is i is really to and a years and they very working <OOV> <OOV> <OOV> <OOV> <OOV> <OOV> <OOV> <OOV> <OOV> <OOV> <OOV> <OOV> <OOV> <OOV> <OOV> <OOV> <OOV> <OOV> <OOV> <OOV> <OOV> <OOV> <OOV> <OOV> <OOV> <OOV> <OOV> <OOV> <OOV> <OOV> <OOV> <OOV> <OOV> <OOV> <OOV> <OOV> <OOV> <OOV> <OOV> <OOV> <OOV> <OOV> <OOV> <OOV> <OOV> <OOV> <OOV> <OOV> <OOV> <OOV> <OOV> <OOV> <OOV> <OOV> <OOV> <OOV> <OOV> <OOV> <OOV> <OOV> <OOV> <OOV> <OOV> <OOV> <OOV> <OOV>', 'i love that the openings and ipod does finger does other it not and for a to thing is would is that to get refills case to see it tablet in it tablet <OOV> <OOV> <OOV> <OOV> <OOV> <OOV> <OOV> <OOV> <OOV> <OOV> <OOV> <OOV> <OOV> <OOV> <OOV> <OOV> <OOV> <OOV> <OOV> <OOV> <OOV> <OOV> <OOV> <OOV> <OOV> <OOV> <OOV> <OOV> <OOV> <OOV> <OOV> <OOV> <OOV> <OOV> <OOV> <OOV> <OOV> <OOV> <OOV> <OOV> <OOV> <OOV> <OOV> <OOV> <OOV> <OOV> <OOV> <OOV> <OOV> <OOV> <OOV> <OOV> <OOV> <OOV> <OOV> <OOV> <OOV> <OOV> <OOV> <OOV> <OOV> <OOV> <OOV> <OOV> <OOV> <OOV> <OOV>', 'having a visio visio visio sony a other office plant plant and a just best 99 was was a done geo up away my <OOV> i it or are updated other app app are it you want it was was found it app app and and app app and size am buy another product adapter <OOV> but it i com depends reviews around i shipping reader i is not be the more pictures i i the nice format use and follow it the sony i i that is other card software the <OOV> format not buy with the screen it', 'i just bought this and is is bought complain how price is a bit case owner of am say it difference tablet is is not in better than quality bravia app is a little purchase and it was me screen games touch the the video the it it i than like only ipad does a i the charger quality is very but would update this lot color is not but been the many you case going about next is not against if i am this color color it color c case is was was the that appreciate it dad to', 'hi performing loved enjoyed bought found for it my mail year class but it got got it first card but is is a but it is a much it the you have to buy it phone in it it it little of videos ago and am looking to get it tablet away in in my and found a you paid pay and was i it chances of and simple to use looking expecting it all the i i up my then day result <OOV> next goes goes not and i card tablet is is and a and and i i']","['we have both the hd and the hd but i love the hd because it is lightweight and very portable all my nooks are converted to android and work very well', 'shipping was very timely and arrived in perfect condition i have used 3 5 a week since i received it and have nothing negative to say about it is is perfect and was a good deal', 'i returned my kindle fire 8 9 after a single day due to no google market a few days later i was at the mall with my girlfriend and i saw an add for the nook hd and nook hd plus now with google market it was enough to draw my attention in once inside in saw another sign for the heavily reduced price tag on the nook hd and nook hd plus i thought man for the price of the one kindle fire hd 8 9 i could get myself two of these nook hd with cases for about', 'i would recommend this product to another person the vendor has excellent customer service this product is an upgrade from my nook color which i have owned for three years and is still working', 'i love all the apps the selection of books and games is great shopping is easy only problem i have is trying to find the app to put my nook on my laptop', 'bought a 16 gb one at my local b n store on sale at 119 fantastic it is totally android hooked right into the <OOV> like google maps and the google play apps store where you guessed it i immediately downloaded the free <OOV> <OOV> amazon kindle app perfect i might buy the b n tablet but books amazon all the way and free acrobat reader which will still enlarge any vector line art in a pdf to 6400 just like on a pc mac note flash and video embedded in a pdf do not play on the nook or', 'i just bought this nook and i cannot believe the screen being a previous nook owner i can tell the new nook hd is built much better the google play store was a wonderful edition because it gives the newer nook hd and hd plus 700 000 more android apps the new charger is wonderful and the overall <OOV> is amazing i will say a nook case is <OOV> ive seen how if your not careful the paint will rub off overall i love the nook and the b n <OOV> service support and classes i got my nook from', 'hi folks i originally had this review in the 7 8gb model when i actually have the 16gb model this review is long but it is so worth reading if you want to keep your nook hd or hd a couple of weeks ago i was going to throw my nook hd 7 on ebay and get what i could for it and take the loss plain and simple i was not using at all often times setting for months one end unused the screen resolution was great but the android os <OOV> sandwich was slow cumbersome and basically not']"
,1,1400532736,having charging to my phone and phone is very good and works great great price good product for the price it would be great for what you need it for and it does what you need it to do and well with a little practice but when you need to plug it in and you have to unplug it when you plug it in to your computer and plug it into the phone when you want to use it to charge the phone or phone to hold up your phone or phone to charge the phone generated in a very,"[""your works good then me tablets and else it usb but but is does and up freezes freezes to and get and it problems with and files and don't not to again not to software is just <OOV> <OOV> <OOV> <OOV> <OOV> <OOV> <OOV> <OOV> <OOV> <OOV> <OOV> <OOV> <OOV> <OOV> <OOV> <OOV> <OOV> <OOV> <OOV> <OOV> <OOV> <OOV> <OOV> <OOV> <OOV> <OOV> <OOV> <OOV> <OOV> <OOV> <OOV> <OOV> <OOV> <OOV> <OOV> <OOV> <OOV> <OOV> <OOV> <OOV> <OOV> <OOV> <OOV> <OOV> <OOV> <OOV> <OOV> <OOV> <OOV> <OOV> <OOV> <OOV> <OOV> <OOV> <OOV> <OOV> <OOV> <OOV> <OOV> <OOV> <OOV> <OOV> <OOV>"", 'i have to buy a new and my dad pandigital and it loved what loves it use it and it vacation it it one and would it case would be a great gift would a and christmas a it and amazon it it would fit it it the books and the and and daughter stores is lived and you would it would be a for thanksgiving it new it was that lot of the that i whole goes not show a cover so is be play to facebook tablet and noble and and and and can looking to use to', ""it's light and marine marine overhead the the <OOV> it background is and it it and and and and it a and it very very product <OOV> <OOV> <OOV> <OOV> <OOV> <OOV> <OOV> <OOV> <OOV> <OOV> <OOV> <OOV> <OOV> <OOV> <OOV> <OOV> <OOV> <OOV> <OOV> <OOV> <OOV> <OOV> <OOV> <OOV> <OOV> <OOV> <OOV> <OOV> <OOV> <OOV> <OOV> <OOV> <OOV> <OOV> <OOV> <OOV> <OOV> <OOV> <OOV> <OOV> <OOV> <OOV> <OOV> <OOV> <OOV> <OOV> <OOV> <OOV> <OOV> <OOV> <OOV> <OOV> <OOV> <OOV> <OOV> <OOV> <OOV> <OOV> <OOV> <OOV> <OOV> <OOV> <OOV> <OOV> <OOV> <OOV> <OOV> <OOV> <OOV> <OOV> <OOV> <OOV> <OOV> <OOV>"", 'easy to use pod and clicking use and it life cute it least and is is it people ever worth and it <OOV> <OOV> <OOV> <OOV> <OOV> <OOV> <OOV> <OOV> <OOV> <OOV> <OOV> <OOV> <OOV> <OOV> <OOV> <OOV> <OOV> <OOV> <OOV> <OOV> <OOV> <OOV> <OOV> <OOV> <OOV> <OOV> <OOV> <OOV> <OOV> <OOV> <OOV> <OOV> <OOV> <OOV> <OOV> <OOV> <OOV> <OOV> <OOV> <OOV> <OOV> <OOV> <OOV> <OOV> <OOV> <OOV> <OOV> <OOV> <OOV> <OOV> <OOV> <OOV> <OOV> <OOV> <OOV> <OOV> <OOV> <OOV> <OOV> <OOV> <OOV> <OOV> <OOV> <OOV> <OOV> <OOV> <OOV> <OOV> <OOV> <OOV> <OOV> <OOV> <OOV> <OOV> <OOV> <OOV> <OOV> <OOV>', 'the here arrived on of schedule estimated estimated date frame was packaged packaged and a problems scratches is a great part the new review owner this a noble noble and cares would would be be the screen nook so you would a new of a future we would be this this again on the reviews reviews again shipping product <OOV> <OOV> <OOV> <OOV> <OOV> <OOV> <OOV> <OOV> <OOV> <OOV> <OOV> <OOV> <OOV> <OOV> <OOV> <OOV> <OOV> <OOV> <OOV> <OOV> <OOV> <OOV> <OOV> <OOV> <OOV> <OOV> <OOV> <OOV> <OOV> <OOV> <OOV> <OOV> <OOV> <OOV> <OOV> <OOV> <OOV> <OOV> <OOV> <OOV> <OOV>', 'just in on the mail thanks thanks recommend not find to buy it thanks order purse thanks would worth thanks worth would thanks would it have thanks write know to the time thanks this works worth thanks protection the the need for buy back my car of go <OOV> <OOV> <OOV> <OOV> <OOV> <OOV> <OOV> <OOV> <OOV> <OOV> <OOV> <OOV> <OOV> <OOV> <OOV> <OOV> <OOV> <OOV> <OOV> <OOV> <OOV> <OOV> <OOV> <OOV> <OOV> <OOV> <OOV> <OOV> <OOV> <OOV> <OOV> <OOV> <OOV> <OOV> <OOV> <OOV> <OOV> <OOV> <OOV> <OOV> <OOV> <OOV> <OOV> <OOV> <OOV> <OOV> <OOV> <OOV> <OOV> <OOV> <OOV> <OOV>', 'first once dislike using review review review review review info stated accessory reviewer and possibilities his daughters and and a and his mail and and of of and the and you to see it tablet to it device frame on the time we what useful and we mail i you to use the the about i can know why of tablet of the tablet and is me and lot of time and getting it phone recipe and that i said it would to use it p2 and a as the i am a hours and day and and the it', 'maybe or not what and get and and and it is a and it i use with it it a with is had to and a was it i do it settings mode of only are matter it the tablet data of <OOV> <OOV> <OOV> <OOV> <OOV> <OOV> <OOV> <OOV> <OOV> <OOV> <OOV> <OOV> <OOV> <OOV> <OOV> <OOV> <OOV> <OOV> <OOV> <OOV> <OOV> <OOV> <OOV> <OOV> <OOV> <OOV> <OOV> <OOV> <OOV> <OOV> <OOV> <OOV> <OOV> <OOV> <OOV> <OOV> <OOV> <OOV> <OOV> <OOV> <OOV> <OOV> <OOV> <OOV> <OOV> <OOV> <OOV> <OOV> <OOV> <OOV> <OOV> <OOV> <OOV> <OOV> <OOV> <OOV> <OOV> <OOV>']","['you are better served reading books or using a computer laptop this device flickers freezes and then runs ahead to fast and having problems uploading epub files also may try kindle or more recent nook editions next', ""i need to buy a gift for my mother's birthday and i know she likes to read books while on break at her job i thought the nook would be a great gift for her after reading reviews here on amazon that it can download and read free ebooks from library sites our local library offers ebooks so i thought it would be great after getting the nook i learned a number of things 1 the nook does not have a browser it can only connect to the barnes and noble online bookstore 2 you are required to have a"", ""it's light and can be read in full sunlight the color nooks screens turn black in <OOV> sunlight for just reading it is a fantastic deal"", 'easy to turn pages by physical buttons but battery is bad at cold weather case and other accesories are cheap and good', 'the nook arrived ahead of the estimated delivery time it was well packaged with no damage this was a replacement for a previous nook purchased at barnes and noble who stated they could not repair the original reader if we have a choice in the future we will buy from amazon based on the great service and quality products', ""just came in the mail today i could not wait to open it in my opinion it is better than nook color i love to read and don't need all the extras and it is perfect for reading outside no need to sit in the shade to read"", ""first i am posting this from my husband's account as an online student many of my course books are available in e book format most course tests and <OOV> allow us to use our notes but the time available for each assignment is very limited since e books allow me to search for information that i don't know off the top of my head it saves me a lot of time versus using the traditional book format that being said i try to use e books as much as possible i spend several hours a day reading to keep up"", ""maybe i'm just used to much faster devices but this is slow and cumbersome to deal with it lost items that i had downloaded into it and when you change the font size the pages no longer reflect the true page numbers""]"
,2,3744295508,bought bought since found this is a great tv and the price i would recommend this to anyone who wants to replace their tv with their tv their tv is great and the price is great and well made and very good price i would recommend this to anyone looking for a good quality product and i have gotten my money's worth i bought it to my brother and he loves it and i haven't tried it yet but it's just what i wanted to do with a set up and it was easy to set up and i haven't,"['purchased purchased a number years ago and they to review a review saying to say that happy happy it to i to complaints with would not puppy to i first one cable ever available i i value i would this <OOV> <OOV> <OOV> <OOV> <OOV> <OOV> <OOV> <OOV> <OOV> <OOV> <OOV> <OOV> <OOV> <OOV> <OOV> <OOV> <OOV> <OOV> <OOV> <OOV> <OOV> <OOV> <OOV> <OOV> <OOV> <OOV> <OOV> <OOV> <OOV> <OOV> <OOV> <OOV> <OOV> <OOV> <OOV> <OOV> <OOV> <OOV> <OOV> <OOV> <OOV> <OOV> <OOV> <OOV> <OOV> <OOV> <OOV> <OOV> <OOV> <OOV> <OOV> <OOV> <OOV> <OOV> <OOV> <OOV> <OOV> <OOV> <OOV> <OOV>', 'much similar than buying about some store store and a year bravia price that thanksgiving a it for bought that it a hdmi cable hdmi not a thieves if bought to to a better <OOV> <OOV> <OOV> <OOV> <OOV> <OOV> <OOV> <OOV> <OOV> <OOV> <OOV> <OOV> <OOV> <OOV> <OOV> <OOV> <OOV> <OOV> <OOV> <OOV> <OOV> <OOV> <OOV> <OOV> <OOV> <OOV> <OOV> <OOV> <OOV> <OOV> <OOV> <OOV> <OOV> <OOV> <OOV> <OOV> <OOV> <OOV> <OOV> <OOV> <OOV> <OOV> <OOV> <OOV> <OOV> <OOV> <OOV> <OOV> <OOV> <OOV> <OOV> <OOV> <OOV> <OOV> <OOV> <OOV> <OOV> <OOV> <OOV> <OOV> <OOV> <OOV> <OOV> <OOV> <OOV> <OOV>', 'exactly what you expected and cheap very a good what made warranty you need would would ordering <OOV> <OOV> <OOV> <OOV> <OOV> <OOV> <OOV> <OOV> <OOV> <OOV> <OOV> <OOV> <OOV> <OOV> <OOV> <OOV> <OOV> <OOV> <OOV> <OOV> <OOV> <OOV> <OOV> <OOV> <OOV> <OOV> <OOV> <OOV> <OOV> <OOV> <OOV> <OOV> <OOV> <OOV> <OOV> <OOV> <OOV> <OOV> <OOV> <OOV> <OOV> <OOV> <OOV> <OOV> <OOV> <OOV> <OOV> <OOV> <OOV> <OOV> <OOV> <OOV> <OOV> <OOV> <OOV> <OOV> <OOV> <OOV> <OOV> <OOV> <OOV> <OOV> <OOV> <OOV> <OOV> <OOV> <OOV> <OOV> <OOV> <OOV> <OOV> <OOV> <OOV> <OOV> <OOV> <OOV> <OOV> <OOV> <OOV> <OOV> <OOV> <OOV> <OOV>', 'my love love happy cable what will what i arrived to a and thank a everywhere you many can goes you that to do to he is would to would it to it a car it it would it i got it it said wrong how would it that that and have it to work up our ipad bravia tv and our tv bravia player and it tv of sound was great clear and the and product for price for the a great price <OOV> <OOV> <OOV> <OOV> <OOV> <OOV> <OOV> <OOV> <OOV> <OOV> <OOV> <OOV> <OOV> <OOV> <OOV> <OOV>', 'this cable is super as as described no very very a new box and is is great would recommend recommend more for again this feet the outstanding cable <OOV> <OOV> <OOV> <OOV> <OOV> <OOV> <OOV> <OOV> <OOV> <OOV> <OOV> <OOV> <OOV> <OOV> <OOV> <OOV> <OOV> <OOV> <OOV> <OOV> <OOV> <OOV> <OOV> <OOV> <OOV> <OOV> <OOV> <OOV> <OOV> <OOV> <OOV> <OOV> <OOV> <OOV> <OOV> <OOV> <OOV> <OOV> <OOV> <OOV> <OOV> <OOV> <OOV> <OOV> <OOV> <OOV> <OOV> <OOV> <OOV> <OOV> <OOV> <OOV> <OOV> <OOV> <OOV> <OOV> <OOV> <OOV> <OOV> <OOV> <OOV> <OOV> <OOV> <OOV> <OOV> <OOV> <OOV> <OOV> <OOV> <OOV> <OOV> <OOV>', 'i bought we ever and and 5 to these cases is ago i bought it going it bought it one it and to loved know it are great and it beat it price it to the apple <OOV> <OOV> <OOV> <OOV> <OOV> <OOV> <OOV> <OOV> <OOV> <OOV> <OOV> <OOV> <OOV> <OOV> <OOV> <OOV> <OOV> <OOV> <OOV> <OOV> <OOV> <OOV> <OOV> <OOV> <OOV> <OOV> <OOV> <OOV> <OOV> <OOV> <OOV> <OOV> <OOV> <OOV> <OOV> <OOV> <OOV> <OOV> <OOV> <OOV> <OOV> <OOV> <OOV> <OOV> <OOV> <OOV> <OOV> <OOV> <OOV> <OOV> <OOV> <OOV> <OOV> <OOV> <OOV> <OOV> <OOV> <OOV> <OOV> <OOV> <OOV> <OOV> <OOV>', 'i bought but and so up having having to to going to get it the and my and bought bought to additional or <OOV> <OOV> <OOV> <OOV> <OOV> <OOV> <OOV> <OOV> <OOV> <OOV> <OOV> <OOV> <OOV> <OOV> <OOV> <OOV> <OOV> <OOV> <OOV> <OOV> <OOV> <OOV> <OOV> <OOV> <OOV> <OOV> <OOV> <OOV> <OOV> <OOV> <OOV> <OOV> <OOV> <OOV> <OOV> <OOV> <OOV> <OOV> <OOV> <OOV> <OOV> <OOV> <OOV> <OOV> <OOV> <OOV> <OOV> <OOV> <OOV> <OOV> <OOV> <OOV> <OOV> <OOV> <OOV> <OOV> <OOV> <OOV> <OOV> <OOV> <OOV> <OOV> <OOV> <OOV> <OOV> <OOV> <OOV> <OOV> <OOV> <OOV> <OOV> <OOV> <OOV> <OOV> <OOV> <OOV> <OOV>', ""great cable refurbish awesome what haven't these because because because that i would watch to ipad to my tv and watch works great <OOV> <OOV> <OOV> <OOV> <OOV> <OOV> <OOV> <OOV> <OOV> <OOV> <OOV> <OOV> <OOV> <OOV> <OOV> <OOV> <OOV> <OOV> <OOV> <OOV> <OOV> <OOV> <OOV> <OOV> <OOV> <OOV> <OOV> <OOV> <OOV> <OOV> <OOV> <OOV> <OOV> <OOV> <OOV> <OOV> <OOV> <OOV> <OOV> <OOV> <OOV> <OOV> <OOV> <OOV> <OOV> <OOV> <OOV> <OOV> <OOV> <OOV> <OOV> <OOV> <OOV> <OOV> <OOV> <OOV> <OOV> <OOV> <OOV> <OOV> <OOV> <OOV> <OOV> <OOV> <OOV> <OOV> <OOV> <OOV> <OOV> <OOV> <OOV> <OOV> <OOV> <OOV> <OOV> <OOV> <OOV>""]","[""purchased this a few years ago and forgot to write a review needless to say i'm still using it and have no problems i purchased this back when the cheapest hdmi cord was 30 00 great buy i recommend it"", 'much cheaper than buying in a local store about one fourth the price after actually using it i realize that having a longer one would make some tasks i need it for much easier', ""exactly what i wanted and expected for a price well under what i thought i'd be paying"", 'my brother is the know it all when it comes to technology electronics and cables and so he usually tells me what to get and what i need i bought this without getting his thought about it but when i got it he was surprised i bought something so satisfactory we used it to hook up my sony bravia tv to my sony bluray player and the clarity and sound is amazingly clear and crisp good product good find at such a great price', 'this cable is cheap came as advertised shipped free with a larger purchase this cable works i would never pay more than like 7 for an hdmi cable', ""i think i've ordered 4 or more of these this year everytime i think i'm done i need another for me or someone else lol they work great and can't beat the price compared to the stores"", ""i bought this but ended up not needing it i'm going to hang onto it in case i ever need an extra cable"", 'great cable great price i bought this cheap cable so that i can connect my laptop to the tv and it works great']"
